{
  "build": {
    "pandoc": "pandoc 3.9.0.2",
    "script": "scripts/build_unit_reader.py"
  },
  "course_id": "C120",
  "language": "id-ID",
  "mastery_path": "backend/mastery/O005-LEGA-V101-CH06.mastery.json",
  "mastery_sha256": "898e4b224ca73073a20a8fb87021d305d00be53f43729eb10d9717cc39dba1b4",
  "notebook_path": "source/id-ID/O005-LEGA-V101-CH06/notebooks/chapter-06-open-two-species-models.ipynb",
  "notebook_sha256": "2bb805326ad45bfb90a914dbd2eb12b5a579e63d0cb60cdce8f4f6c8928eb33a",
  "problems": [
    "O005-LEGA-V101-CH06-P01",
    "O005-LEGA-V101-CH06-P02",
    "O005-LEGA-V101-CH06-P03",
    "O005-LEGA-V101-CH06-P04",
    "O005-LEGA-V101-CH06-P05",
    "O005-LEGA-V101-CH06-P06"
  ],
  "resource_id": "O005",
  "schema": "o005-unit-v1",
  "segments": {
    "count": 211,
    "path": "backend/segments/O005-LEGA-V101-CH06.segments.jsonl",
    "sha256": "f6e18702e5d7c5ed521a487b5439d888f942b052fda194cbc16217feacc0eecf"
  },
  "source": {
    "author": "Joceline Lega",
    "chapter": "Two-Species Models",
    "content_sha256": "d9e372db30a8afbae16bdc43f03fa486035c87deb5f8db774ae2e671d6594938",
    "edition": "v1.01 (Maret 2026)",
    "license": "CC BY-NC-SA 4.0",
    "url": "https://opentextbooks.library.arizona.edu/mathematicalmodeling/chapter/two-species-models/",
    "work": "Introduction to Mathematical Modeling"
  },
  "source_language": "en",
  "target": {
    "content_path": "source/id-ID/O005-LEGA-V101-CH06/content.html",
    "content_sha256": "67e09680f3a67626a2a6761dd4376202985d87a06bdea72dbbd59978b9b08564",
    "figures": [
      {
        "path": "source/id-ID/O005-LEGA-V101-CH06/assets/predator-prey-damped-source.png",
        "sha256": "5f714f9670a8a634d3f6e41571e4be8423b53a7991f4ce3ea159c54c439a72df"
      },
      {
        "path": "source/id-ID/O005-LEGA-V101-CH06/assets/predator-prey-closed-source.png",
        "sha256": "12c7e47611611ad9bdbf822d0ecac1abd5a54b3302aeff9cd037bd9a0d42f6c3"
      },
      {
        "path": "source/id-ID/O005-LEGA-V101-CH06/assets/competition-coexistence-source.png",
        "sha256": "4eea679f5d3449746b333e429c8be8c2340348f130a705fe2e05597b8c76f765"
      },
      {
        "path": "source/id-ID/O005-LEGA-V101-CH06/assets/competition-exclusion-source.png",
        "sha256": "2675913333eaecef42fbec40ec78f24a3ea555217ade399bb159e2c5c5739c53"
      }
    ],
    "title": "Model Populasi Dua Spesies"
  },
  "unit_id": "O005-LEGA-V101-CH06"
}
