{
  "build": {
    "pandoc": "pandoc 3.9.0.2",
    "script": "scripts/build_unit_reader.py"
  },
  "course_id": "C120",
  "language": "id-ID",
  "mastery_path": "backend/mastery/O005-LEGA-V101-CH07.mastery.json",
  "mastery_sha256": "96b941b74965c44edc3529e940cdad77e1b1eb0b9065624dfbe3723204b03788",
  "notebook_path": "source/id-ID/O005-LEGA-V101-CH07/notebooks/chapter-07-open-epidemiology.ipynb",
  "notebook_sha256": "92a9cf27d48d5e7766881592095f1232cc4d2357ee5d0a46bdb871591afafce4",
  "problems": [
    "O005-LEGA-V101-CH07-P01",
    "O005-LEGA-V101-CH07-P02",
    "O005-LEGA-V101-CH07-P03",
    "O005-LEGA-V101-CH07-P04",
    "O005-LEGA-V101-CH07-P05"
  ],
  "resource_id": "O005",
  "schema": "o005-unit-v1",
  "segments": {
    "count": 162,
    "path": "backend/segments/O005-LEGA-V101-CH07.segments.jsonl",
    "sha256": "92a26ba1160e96a59eca8d54dd7d8758e95ed66b2231a2a5697ac3d6e8d2ca87"
  },
  "source": {
    "author": "Joceline Lega",
    "chapter": "Epidemiology",
    "content_sha256": "027493e86a470e8573d48833b41e4bc365910b255bd7324f1d7ae3272d17c38c",
    "edition": "v1.01 (Maret 2026)",
    "license": "CC BY-NC-SA 4.0",
    "url": "https://opentextbooks.library.arizona.edu/mathematicalmodeling/chapter/epidemiology/",
    "work": "Introduction to Mathematical Modeling"
  },
  "source_language": "en",
  "target": {
    "content_path": "source/id-ID/O005-LEGA-V101-CH07/content.html",
    "content_sha256": "092c0eaeb8641895c19adb81d5688b67c2814efa37eea3c7c0d487668b37394f",
    "figures": [
      {
        "path": "source/id-ID/O005-LEGA-V101-CH07/assets/sir-phase-source.png",
        "sha256": "6fb4ddda16dc32455db64ec8211e561260118f5a2994aa88b503a179d851c08b"
      },
      {
        "path": "source/id-ID/O005-LEGA-V101-CH07/assets/endemic-phase-1-source.png",
        "sha256": "20862c9a7ae87d9d6cc5d3c00a5ea855ee7c7a786cd832e40b6aebf8acbb63af"
      },
      {
        "path": "source/id-ID/O005-LEGA-V101-CH07/assets/endemic-phase-2-source.png",
        "sha256": "e1b4360292dceb3d403cc54cc1b76cf1b45d80a9331acdad6a2f460d77eb9058"
      }
    ],
    "title": "Epidemiologi"
  },
  "unit_id": "O005-LEGA-V101-CH07"
}
